{
  "schemaVersion": 1,
  "packageName": "@authrim/ar-userinfo",
  "worker": "ar-userinfo",
  "lookupBlindIndex": true,
  "requiredDataRoles": ["tenant_core/default", "tenant_core/users", "tenant_pii", "lookup"],
  "bindings": [
    { "name": "SETTINGS", "kind": "kv_namespace", "required": true },
    {
      "name": "GUEST_UPGRADE_READINESS",
      "kind": "service",
      "required": true,
      "capability": "guest_upgrade.readiness"
    },
    {
      "name": "DB_ADMIN",
      "kind": "d1",
      "required": true,
      "capability": "identity_mapping.read"
    },
    { "name": "LOOKUP_DB", "kind": "d1", "required": true, "dataRole": "lookup" },
    { "name": "CLIENTS_CACHE", "kind": "kv_namespace", "required": true },
    { "name": "USER_CACHE", "kind": "kv_namespace", "required": true },
    { "name": "AUTHRIM_CONFIG", "kind": "kv_namespace", "required": true },
    { "name": "TENANT_RUNTIME_REGISTRY", "kind": "kv_namespace", "required": true },
    { "name": "KEY_MANAGER", "kind": "durable_object_namespace", "required": true },
    { "name": "SESSION_STORE", "kind": "durable_object_namespace", "required": true },
    { "name": "RATE_LIMITER", "kind": "durable_object_namespace", "required": true },
    { "name": "DPOP_JTI_STORE", "kind": "durable_object_namespace", "required": true },
    { "name": "TOKEN_REVOCATION_STORE", "kind": "durable_object_namespace", "required": true },
    { "name": "LOGGING_DELIVERY_CRITICAL_QUEUE", "kind": "queue", "required": false },
    { "name": "LOGGING_DELIVERY_QUEUE", "kind": "queue", "required": false },
    { "name": "LOGGING_DELIVERY_BULK_QUEUE", "kind": "queue", "required": false },
    {
      "name": "TENANT_DATABASE_HYPERDRIVE",
      "kind": "hyperdrive",
      "required": false,
      "capability": "tenant_database_profiles"
    },
    { "name": "CONTROL_SMOKE_VERSION", "kind": "version_metadata", "required": true }
  ],
  "secrets": [
    { "name": "PUBLIC_JWK_JSON", "capability": "legacy_signing.public", "required": true },
    {
      "name": "TENANT_RUNTIME_REGISTRY_VERIFYING_PUBLIC_JWKS",
      "capability": "runtime_registry.verify",
      "required": true
    },
    {
      "name": "LOOKUP_HMAC_KEY_SLOT_A",
      "capability": "lookup_blind_index",
      "required": true
    },
    {
      "name": "LOOKUP_HMAC_KEY_SLOT_B",
      "capability": "lookup_blind_index",
      "required": false
    },
    {
      "name": "DOWNSTREAM_GRANT_INTROSPECTION_CLIENT_ID",
      "capability": "downstream_introspection.client",
      "required": false
    },
    {
      "name": "DOWNSTREAM_GRANT_INTROSPECTION_CLIENT_SECRET",
      "capability": "downstream_introspection.client",
      "required": false
    },
    {
      "name": "CONTROL_SMOKE_VERIFYING_PUBLIC_JWKS",
      "capability": "control_smoke.verify",
      "required": true
    }
  ]
}
