{
  "schemaVersion": 1,
  "packageName": "@authrim/ar-async",
  "worker": "ar-async",
  "lookupBlindIndex": true,
  "requiredDataRoles": [
    "tenant_core/default",
    "tenant_core/users",
    "tenant_pii",
    "lookup"
  ],
  "bindings": [
    {
      "name": "LOOKUP_DB",
      "kind": "d1",
      "required": true,
      "dataRole": "lookup"
    },
    {
      "name": "INITIAL_ACCESS_TOKENS",
      "kind": "kv_namespace",
      "required": true
    },
    {
      "name": "SETTINGS",
      "kind": "kv_namespace",
      "required": true,
      "capability": "settings.read"
    },
    {
      "name": "AUTHRIM_CONFIG",
      "kind": "kv_namespace",
      "required": true
    },
    {
      "name": "TENANT_RUNTIME_REGISTRY",
      "kind": "kv_namespace",
      "required": true
    },
    {
      "name": "DEVICE_CODE_STORE",
      "kind": "durable_object_namespace",
      "required": true
    },
    {
      "name": "CIBA_REQUEST_STORE",
      "kind": "durable_object_namespace",
      "required": true
    },
    {
      "name": "DPOP_JTI_STORE",
      "kind": "durable_object_namespace",
      "required": true
    },
    {
      "name": "SESSION_STORE",
      "kind": "durable_object_namespace",
      "required": true
    },
    {
      "name": "USER_CODE_RATE_LIMITER",
      "kind": "durable_object_namespace",
      "required": true
    },
    {
      "name": "RATE_LIMITER",
      "kind": "durable_object_namespace",
      "required": true
    },
    {
      "name": "KEY_MANAGER_PUBLIC",
      "kind": "service",
      "required": false,
      "capability": "signing_keys.public.read"
    },
    {
      "name": "DIAGNOSTIC_LOGS",
      "kind": "r2_bucket",
      "required": false
    },
    {
      "name": "AUDIT_ARCHIVE",
      "kind": "r2_bucket",
      "required": false
    },
    {
      "name": "LOGGING_DELIVERY_CRITICAL_QUEUE",
      "kind": "queue",
      "required": false
    },
    {
      "name": "LOGGING_DELIVERY_QUEUE",
      "kind": "queue",
      "required": false
    },
    {
      "name": "LOGGING_DELIVERY_BULK_QUEUE",
      "kind": "queue",
      "required": false
    },
    {
      "name": "TENANT_DATABASE_HYPERDRIVE",
      "kind": "hyperdrive",
      "required": false,
      "capability": "tenant_database_profiles"
    },
    {
      "name": "CONTROL_SMOKE_VERSION",
      "kind": "version_metadata",
      "required": true
    },
    {
      "name": "LOG_ARCHIVE_WRITER",
      "kind": "service",
      "required": false,
      "capability": "logging.archive.write"
    }
  ],
  "secrets": [
    {
      "name": "OBJECT_ENCRYPTION_ROOT_KEY",
      "capability": "diagnostic_log.encrypt",
      "required": true
    },
    {
      "name": "TENANT_RUNTIME_REGISTRY_VERIFYING_PUBLIC_JWKS",
      "capability": "runtime_registry.verify",
      "required": true
    },
    {
      "name": "LOOKUP_HMAC_KEY_SLOT_A",
      "capability": "lookup_blind_index",
      "required": true
    },
    {
      "name": "LOOKUP_HMAC_KEY_SLOT_B",
      "capability": "lookup_blind_index",
      "required": false
    },
    {
      "name": "CONTROL_SMOKE_VERIFYING_PUBLIC_JWKS",
      "capability": "control_smoke.verify",
      "required": true
    },
    {
      "name": "LOG_ARCHIVE_CONTENT_HMAC_KEY",
      "required": false,
      "capability": "logging.archive.encrypt"
    },
    {
      "name": "LOG_ARCHIVE_ROOT_KEYRING",
      "required": false,
      "capability": "logging.archive.encrypt"
    }
  ]
}
